[
  {
    "id": "mtm_018ab3a21a85",
    "name": "Commit abc123",
    "summary": "Commit abc123: Fix division by zero in computeMetrics (fixes #242)",
    "project_id": "innocody-demo",
    "timestamp": "2025-09-01T14:09:20.480000",
    "metadata": {
      "change_type": "bugfix",
      "git_commit": "abc123",
      "author": "John Doe",
      "embedding": [
        0.5871468383337091,
        0.6877749104609794,
        0.05943745895741315,
        0.9937867102324879,
        0.5292257394479957,
        0.8065443226711101,
        0.9250732712771548,
        0.11383305616505279,
        0.31540562640766756,
        0.3936344354830824,
        0.7530580235711639,
        0.08179696226229016,
        0.05936968782663965,
        0.8860071746151175,
        0.02306087060273332,
        0.2620133590313346,
        0.2305024320635063,
        0.22144313986166497,
        0.6780614894623549,
        0.7043775599484012,
        0.7739706301606781,
        0.012589832990015815,
        0.12480740439023108,
        0.2748892168781545,
        0.09839900929682444,
        0.39155160186923765,
        0.30951203667008864,
        0.7353614606314798,
        0.18956648756789118,
        0.5917843580586517,
        0.32949184490691963,
        0.3022503672696125,
        0.17715630601901144,
        0.12613859414342377,
        0.47872364616581875,
        0.09597668510754687,
        0.6649202348352756,
        0.5876673402901614,
        0.7718248861367543,
        0.42363344043481166,
        0.3679405125252184,
        0.29146814639161855,
        0.8031019539504132,
        0.2683780509300653,
        0.7582936632120683,
        0.7200281281628601,
        0.08598302486106335,
        0.07238197130997592,
        0.40151509084151804,
        0.5595099515560912,
        0.014994063331040586,
        0.2909046661534167,
        0.5956574972034239,
        0.366198316256926,
        0.5513194803476065,
        0.7156295863338131,
        0.3643817000404934,
        0.7233524849073161,
        0.32027918065359384,
        0.3586073455855088,
        0.45058339950006365,
        0.969552895747921,
        0.5591527182592968,
        0.1577610306615187,
        0.7298893615417101,
        0.20213570281686466,
        0.5743617341099756,
        0.9630080863252976,
        0.1283101789161577,
        0.4676842980866647,
        0.2019545164255513,
        0.49341607853377,
        0.7653195838910166,
        0.428252511813799,
        0.18863688787284605,
        0.06454450523396671,
        0.764258883473401,
        0.557903307348503,
        0.6670938621763576,
        0.8912345668001029,
        0.5522922625258885,
        0.2016850370535952,
        0.7860178041001356,
        0.3744273566483374,
        0.3382676427808996,
        0.1964866561100188,
        0.25072634982376096,
        0.8646134792055794,
        0.6584780709120932,
        0.2701432630416184,
        0.7417807286187279,
        0.15440066239338757,
        0.3822481207714775,
        0.4966235945584202,
        0.21660433736503448,
        0.01656166949934612,
        0.4970495856414634,
        0.7082822432817576,
        0.8652617711691999,
        0.909104844062855,
        0.056104326102408564,
        0.15645401551383875,
        0.8672863223255434,
        0.2672041921416417,
        0.40307868414211967,
        0.12631723696285235,
        0.7246388060199273,
        0.7896088901088504,
        0.15979732985731643,
        0.6397681844455843,
        0.3988974978511184,
        0.45016764017662914,
        0.5948557070166941,
        0.19867121072111682,
        0.15912559820385952,
        0.13341588496665402,
        0.3133174906707028,
        0.9235130682142272,
        0.32811504974956873,
        0.06475250007370115,
        0.5601490708852341,
        0.46155540351407953,
        0.9771205825742001,
        0.2312028352216704,
        0.7756780207511335,
        0.9107011464087992,
        0.37320582074207065,
        0.976552305329134,
        0.7902989834431757,
        0.5414980843931265,
        0.6317610366217503,
        0.294543179906412,
        0.00014088160068737032,
        0.37021976856807115,
        0.18978942567792934,
        0.7421519645838166,
        0.3089278804846739,
        0.5217926070266635,
        0.018938860169143368,
        0.8404344236546135,
        0.9140572489377313,
        0.33288853845203925,
        0.7449528637737401,
        0.477250628707633,
        0.314183400245425,
        0.7043867698606806,
        0.2601968115365003,
        0.5723768780302165,
        0.8734014443738425,
        0.20946855738906767,
        0.2868893578928473,
        0.19651320523523097,
        0.31133513137631896,
        0.20814817488658555,
        0.19629731572044362,
        0.46784081231846697,
        0.658377719560953,
        0.22302056150950778,
        0.47062045416831155,
        0.6578601457850297,
        0.06031618655852844,
        0.1694334608040159,
        0.4012797041757542,
        0.6028585893062169,
        0.5844174028295087,
        0.21483719101828036,
        0.17414788016378402,
        0.7798512310108668,
        0.4448787829150648,
        0.5504528541894698,
        0.2901261933512289,
        0.10607491533923397,
        0.3234527891137612,
        0.5436768159633614,
        0.14890589594805237,
        0.08127849889086025,
        0.2697078793631087,
        0.8427630275679732,
        0.3608576956733177,
        0.02114351128829306,
        0.5800201944678348,
        0.0012781919999015345,
        0.9659883516677822,
        0.11328420272058859,
        0.5321458626390494,
        0.6219523747110798,
        0.2036091717302445,
        0.32142324449733906,
        0.15346577501429837,
        0.5923491854209996,
        0.5097486796287556,
        0.9983447430213438,
        0.6702178969088486,
        0.49126224127475415,
        0.8545235959804546,
        0.7717125713682201,
        0.897650810576647,
        0.02553714410244068,
        0.5440973932664314,
        0.7440572753691771,
        0.21189328192070211,
        0.9985736354438665,
        0.2868455660922641,
        0.7759383987239689,
        0.8173997425865599,
        0.12268105348022729,
        0.4301996898397177,
        0.49974166681326293,
        0.35663555818910553,
        0.45387420603720496,
        0.7513250905291825,
        0.03355304391482927,
        0.12837831248042442,
        0.7665784667960288,
        0.9584732838371848,
        0.3124582652238108,
        0.2491923430011913,
        0.6515525036715315,
        0.09107497881843563,
        0.5100714366248779,
        0.15334709631660615,
        0.11349287263413976,
        0.05180584631174934,
        0.3780796034362327,
        0.9674984665567238,
        0.1729137505800309,
        0.9996096645528888,
        0.8060035004248313,
        0.3003808507178659,
        0.7154455179227036,
        0.73645030445767,
        0.979827469410491,
        0.23895329012219024,
        0.06281606439848897,
        0.2474412336180355,
        0.6662062545758702,
        0.725791890234966,
        0.9591434757999511,
        0.9827860728655182,
        0.7077720263848584,
        0.8969795993755912,
        0.17629343421216515,
        0.4891737967709632,
        0.20712794852419392,
        0.9115249540065852,
        0.5805027066574451,
        0.40969773062642045,
        0.7592122277948495,
        0.34986168526842354,
        0.6655287024667836,
        0.6680478317211899,
        0.031542655109143225,
        0.3192839629334433,
        0.4679416809881749,
        0.15426891216545624,
        0.9592841391899695,
        0.5923684012780864,
        0.4269766695294126,
        0.2468358624274124,
        0.8322760346413903,
        0.6205257871754614,
        0.011107264275417972,
        0.8036501323482987,
        0.3730000907334071,
        0.6044783859131259,
        0.38995835917988253,
        0.38659700551948284,
        0.17774054388855198,
        0.26806269577532305,
        0.7708764687569792,
        0.347931862724588,
        0.8744560403693625,
        0.9589709358042295,
        0.9187658118483356,
        0.702755029087837,
        0.9734512749788242,
        0.8611496835798994,
        0.7316430677803939,
        0.2928838448003218,
        0.15258832657235322,
        0.32881859645582256,
        0.3610284121378998,
        0.7832165489942616,
        0.5154065077167915,
        0.01820234101349205,
        0.9047834372788902,
        0.06147166160116191,
        0.160561391044173,
        0.5632576812688944,
        0.23580079740317617,
        0.4901032484970891,
        0.3221442618026129,
        0.38524956443462344,
        0.2541303779741073,
        0.7733429620241715,
        0.14570206000485775,
        0.5956773155318841,
        0.14532089970332873,
        0.2960678212926844,
        0.6811198271660753,
        0.8822487622156272,
        0.17002920661627596,
        0.09730315767033626,
        0.5701476114451248,
        0.7664283143135571,
        0.3979471200073994,
        0.6594426999549433,
        0.35051520032532846,
        0.18803992204854403,
        0.776171625095028,
        0.29363122374903206,
        0.29772227695678477,
        0.19963863808169513,
        0.6983884928491738,
        0.654838251185119,
        0.5778937222592554,
        0.8747549954718329,
        0.4677093822269044,
        0.20868185305287124,
        0.17778434842939617,
        0.7688766676932659,
        0.5901311719055694,
        0.713841107941366,
        0.2432823901546991,
        0.9091258787805082,
        0.8065541802548226,
        0.9690494982120182,
        0.5149797863467824,
        0.7466913021698709,
        0.5981630241239823,
        0.9864028166308021,
        0.07934220994723695,
        0.032139999237016825,
        0.7051094694096318,
        0.3817829261237523,
        0.7592133314730071,
        0.8267530666514017,
        0.5228678523349932,
        0.2656293398614441,
        0.5552306956910086,